{
  "kind": "asset-factory-batch",
  "schemaVersion": 1,
  "batchId": "smoke-batch-3d",
  "entryPoint": "generate-asset-from-prompt",
  "defaults": {
    "geometryMethod": "trellis",
    "projectProfile": "",
    "autoImport": false,
    "targetHeight": 1.0
  },
  "items": [
    {
      "id": "crate_a",
      "prompt": "small sci-fi cargo container, hard surface design, clean silhouette, neutral studio background",
      "params": {
        "negativePrompt": "",
        "seed": 1234
      }
    }
  ]
}
