{
  "kind": "asset-factory-batch",
  "schemaVersion": 1,
  "batchId": "smoke-batch",
  "entryPoint": "generate-image",
  "items": [
    {
      "id": "crate_a",
      "prompt": "small sci-fi cargo container, hard surface design, clean silhouette, neutral studio background",
      "params": {
        "negativePrompt": "",
        "seed": 1234
      }
    },
    {
      "id": "crate_b",
      "prompt": "compact industrial sci-fi storage crate, reinforced corners, clean silhouette, neutral studio background",
      "params": {
        "negativePrompt": "",
        "seed": 5678
      }
    }
  ]
}
